{
  "schema_version": 1,
  "kind": "host",
  "protocol": {
    "id": "stellar",
    "name": "Soroban host",
    "network_protocol": 28
  },
  "source": {
    "repo": "https://github.com/stellar/rs-soroban-env",
    "commit": "5061e9c40ce6fc74ade9b9b3b49465b0cf7fdccb",
    "tag": "v28.0.2"
  },
  "errors": [
    {
      "type": "Auth",
      "code": "ExistingValue",
      "summary": "This signed authorization was already used (replayed nonce).",
      "explanation": "Every signed auth entry carries a nonce that can only be consumed once.",
      "messages": [
        "nonce already exists for address"
      ],
      "category": "transaction-building",
      "common_causes": [
        "Resubmitting a transaction (or reusing auth entries) that already succeeded.",
        "Copying signed auth entries from one transaction into another."
      ],
      "fixes": [
        "Re-simulate to get fresh auth entries with a new nonce, then sign again."
      ],
      "source_files": [
        "soroban-env-host/src/auth.rs"
      ],
      "status": "draft"
    },
    {
      "type": "Auth",
      "code": "InvalidAction",
      "summary": "A required authorization was missing or failed.",
      "explanation": "\"Unauthorized function call for address\" means a contract called require_auth() (or require_auth_for_args) for an address, and the transaction had no matching signed auth entry. \"failed account authentication with error\" means a matching entry existed but the account rejected it. For a classic G-account, look for Error(Contract, #5) in the diagnostic events (see stellar/sac#5). For a smart wallet, it is that wallet's own __check_auth error.",
      "messages": [
        "Unauthorized function call for address",
        "failed account authentication with error"
      ],
      "category": "permissions",
      "common_causes": [
        "The transaction was not re-simulated after its arguments changed, so the auth entry covers different arguments.",
        "Signing with the wrong account, or not signing the auth entries at all (only the transaction envelope).",
        "A contract calling another contract on its own behalf without authorize_as_current_contract().",
        "A multisig or smart-wallet signer set that does not meet the account's rules."
      ],
      "fixes": [
        "Simulate the exact final transaction and sign every returned auth entry for the address named in the event.",
        "Read the next diagnostic event to see why the account rejected the signature."
      ],
      "source_files": [
        "soroban-env-host/src/auth.rs"
      ],
      "references": [
        {
          "title": "Stellar docs — Authorization",
          "url": "https://developers.stellar.org/docs/learn/fundamentals/contract-development/authorization"
        }
      ],
      "status": "draft"
    },
    {
      "type": "Auth",
      "code": "InvalidInput",
      "summary": "The signed authorization has expired, or its expiry is too far ahead.",
      "explanation": "Each signed auth entry has a signature expiration ledger. It must not have passed, and it must not be beyond the network's maximum TTL.",
      "messages": [
        "signature has expired",
        "signature expiration is too late"
      ],
      "category": "transaction-building",
      "common_causes": [
        "The user took too long to sign, or the transaction was submitted long after signing.",
        "Setting the expiration ledger far in the future by hand."
      ],
      "fixes": [
        "Re-simulate and re-sign the auth entries with an expiration ledger a short way past the current ledger, then submit promptly."
      ],
      "source_files": [
        "soroban-env-host/src/auth.rs"
      ],
      "status": "draft"
    },
    {
      "type": "Budget",
      "code": "ExceededLimit",
      "summary": "The call ran out of CPU instructions or memory.",
      "explanation": "The invocation used more CPU instructions or memory than the transaction declared, or than the network allows. Wasm stack overflow and running out of fuel map here too. This error cannot be caught by a calling contract.",
      "category": "resources",
      "common_causes": [
        "Resources come from an old simulation, and the contract's state has since grown (larger vectors or maps to iterate).",
        "Unbounded loops over storage, or storing large Vec/Map values in one key.",
        "Heavy cryptography or deep recursion."
      ],
      "fixes": [
        "Re-simulate right before submitting, and add a safety margin to the instruction limit.",
        "If simulation itself fails here, the work exceeds network limits: paginate, split the work across transactions, or move large collections into separate storage keys.",
        "Check current network limits with `stellar network settings`."
      ],
      "source_files": [
        "soroban-env-host/src/budget/dimension.rs",
        "soroban-env-common/src/error.rs"
      ],
      "references": [
        {
          "title": "Stellar docs — Resource limits & fees",
          "url": "https://developers.stellar.org/docs/networks/resource-limits-fees"
        }
      ],
      "status": "draft"
    },
    {
      "type": "Context",
      "code": "ExceededLimit",
      "summary": "Call depth or value nesting went past the host's limit.",
      "explanation": "Raised when contract-to-contract calls (or recursion) nest too deeply, or when a value or XDR structure is too deep or too large to decode.",
      "category": "contract-bug",
      "common_causes": [
        "Recursive cross-contract calls.",
        "Deeply nested data structures passed as arguments."
      ],
      "fixes": [
        "Flatten the call chain or the data structure."
      ],
      "source_files": [
        "soroban-env-host/src/host/frame.rs",
        "soroban-env-common/src/error.rs"
      ],
      "status": "draft"
    },
    {
      "type": "Context",
      "code": "InvalidAction",
      "summary": "The call pattern is not allowed: re-entry, a reserved function, or a failed constructor.",
      "messages": [
        "Contract re-entry is not allowed",
        "can't invoke a reserved function directly",
        "constructor invocation has failed with error"
      ],
      "category": "contract-bug",
      "common_causes": [
        "Contract A calls B, and B calls back into A in the same invocation.",
        "Calling __constructor or __check_auth directly.",
        "A deploy whose constructor panicked; the next diagnostic event holds the constructor's own error."
      ],
      "fixes": [
        "Restructure so callbacks into the original contract are not needed.",
        "For constructors, look up the inner error emitted just before this one."
      ],
      "source_files": [
        "soroban-env-host/src/host/frame.rs",
        "soroban-env-host/src/host/lifecycle.rs"
      ],
      "status": "draft"
    },
    {
      "type": "Crypto",
      "code": "InvalidInput",
      "summary": "A signature or cryptographic input failed verification.",
      "explanation": "Raised by host crypto functions such as ed25519_verify and secp256r1_verify (passkeys), and by BLS12-381 or BN254 operations given invalid input. In smart wallets this usually means the signature does not match the payload being authorized.",
      "messages": [
        "failed ED25519 verification",
        "failed secp256r1 verification",
        "ECDSA signature 's' part is not normalized to low form",
        "invalid ed25519 public key"
      ],
      "category": "permissions",
      "common_causes": [
        "Signing a different payload than the contract verifies (e.g. the wrong auth-entry preimage or network passphrase).",
        "Passkey (secp256r1) signatures not in 64-byte compact form, or with a high 's' value that was not normalised to low-S.",
        "Using the wrong public key for the signer."
      ],
      "fixes": [
        "Recompute the signed payload exactly as the contract does, including the network passphrase.",
        "Normalise secp256r1 signatures to compact low-S form before sending."
      ],
      "source_files": [
        "soroban-env-host/src/crypto/mod.rs"
      ],
      "status": "draft"
    },
    {
      "type": "Object",
      "code": "IndexBounds",
      "summary": "A Vec or Bytes index was out of range.",
      "explanation": "The contract used an unchecked or panicking accessor on a host object with an index past its end.",
      "messages": [
        "object index out of bounds",
        "bytes_get out of bounds"
      ],
      "category": "contract-bug",
      "common_causes": [
        "Vec::get_unchecked, Bytes::get_unchecked or a slice call on an empty or shorter-than-expected collection."
      ],
      "fixes": [
        "Use the checked get(), which returns an Option, and handle the empty case, or check len() first."
      ],
      "source_files": [
        "soroban-env-host/src/host/error.rs",
        "soroban-env-host/src/host.rs"
      ],
      "status": "draft"
    },
    {
      "type": "Object",
      "code": "MissingValue",
      "summary": "A Map key the contract required is not in the map.",
      "messages": [
        "map key not found in map_get",
        "map key not found in map_del"
      ],
      "category": "contract-bug",
      "common_causes": [
        "Map::get_unchecked or remove_unchecked for a key that is not present."
      ],
      "fixes": [
        "Use Map::get(), which returns an Option, and handle the missing case."
      ],
      "source_files": [
        "soroban-env-host/src/host.rs"
      ],
      "status": "draft"
    },
    {
      "type": "Storage",
      "code": "ExceededLimit",
      "summary": "The contract touched a ledger entry that is not in the transaction's footprint.",